[
  {
    "id": "npc_outfitter",
    "landmarkId": "legacy_junction",
    "name": "The Outfitter",
    "intro": "The Outfitter has equipped four hundred parties and been to Production zero times. He does not consider this a contradiction. Travel agents, he points out, do not live in the destinations. He stocks engines on one wall and everything-around-the-engine on the other, and he has watched a decade of customers stare at the wrong wall.",
    "advice": {
      "correct": "Folks spend all day picking the engine and thirty seconds picking everything around it. It's the everything-around-it that walks out of that canyon alive. Same engine in a different rig is a different animal entirely.",
      "wrong": "Between us: buy the smartest model on the shelf and the rest sorts itself out. Smart finds a way. Always has."
    },
    "options": [
      { "id": "ask_harness", "label": "Ask what the harness wall actually does", "response": "He lights up. Nobody asks. He walks you through recovery, tool reach, the part that decides when to stop. 'The stopping part,' he says, 'is the part the dead ones didn't buy.'", "effects": { "credibility": 2 } },
      { "id": "ask_engine", "label": "Ask which model is the smartest", "response": "He sells you the answer without argument, the way a man sells a hat to someone asking for a boat. The receipt is itemised. Item one is the hat.", "effects": { "credibility": -1, "morale": 1 } },
      { "id": "ask_trail", "label": "Ask about the trail ahead", "response": "'Long. Governed.' He gestures at a wall of forms. 'Take spare attestations. They spoil slower than everything else out there.'", "effects": { "morale": -1 } }
    ]
  },
  {
    "id": "npc_prompt_curator",
    "landmarkId": "fort_prompt",
    "name": "The Prompt Curator",
    "intro": "The Curator maintains the fort's collection. She can recite the great prompts from memory and does, unprompted, which she acknowledges is the only unprompted thing that happens here. She was an engineer once. She remembers shipping the way other people remember a country they left as children.",
    "advice": {
      "correct": "A mediocre request inside a loop that checks its work beats our best prompt standing alone. I know the exact worth of our best prompt standing alone. I dust it.",
      "wrong": "The breakthrough is close. Prompt forty-one nearly worked, and forty-two has a stronger persona. Refine the wording until the work happens. It is the wording."
    },
    "options": [
      { "id": "read_prompt", "label": "Read the famous prompt", "response": "It is genuinely very good. You feel it trying to compensate — for the missing tools, the missing tests, the missing loop — the way a beautiful letter compensates for nobody coming home.", "effects": { "morale": 1 } },
      { "id": "ask_after", "label": "Ask what happens after the prompt is sent", "response": "A long pause. 'We read the response,' she says, 'and then we improve the prompt.' She hears it as she says it. You watch her hear it.", "effects": { "credibility": 2, "morale": -1 } },
      { "id": "donate", "label": "Donate your starting prompt to the collection", "response": "She files it with real tenderness under Early Optimism, between four thousand others. The drawer closes with the sound of a decision being deferred.", "effects": { "credibility": 1 } }
    ]
  },
  {
    "id": "npc_rut_reader",
    "landmarkId": "loop_fork",
    "name": "The Rut-Reader",
    "intro": "An old surveyor who reads wheel ruts the way others read ledgers. She can tell a one-shot party from a loop party at two hundred yards: the one-shots leave a single deep line, very straight, very confident, ending abruptly. The loops leave circles that tighten like handwriting getting sure of itself.",
    "advice": {
      "correct": "Small circles, checked often. Act, look at what actually happened, adjust, go again. The looking is the part that isn't optional. The ruts that skip the looking all end in the same place, and I can show you the place.",
      "wrong": "If a loop fails, run it again with more retries. Retries are what looping means. No sense reading the output each time — that's what the retries are for."
    },
    "options": [
      { "id": "study_ruts", "label": "Study the failed ruts with her", "response": "Every dead-end track shares one feature: no adjustment marks. They acted, and acted, and acted. 'Nothing ever came back in,' she says. 'Beautiful penmanship, though.'", "effects": { "credibility": 2 } },
      { "id": "ask_shortcut", "label": "Ask if the straight road is ever right", "response": "'For small, known things, surely. The dead ones out there weren't doing small, known things. They were doing hope, at scale, in one push.'", "effects": { "morale": 1 } },
      { "id": "buy_map", "label": "Buy her annotated map", "response": "The map marks where each party stopped observing. The marks cluster early. She charges fairly and includes, free, the fact that nobody has ever bought a second copy for a friend.", "effects": { "credibility": 1, "tokens": -10 } }
    ]
  },
  {
    "id": "npc_bridge_inspector",
    "landmarkId": "verifier_ridge",
    "name": "The Bridge Inspector",
    "intro": "The Inspector has one job and one question, and the question is the job: how will you know it worked? He has heard every answer. He keeps the best ones in a notebook titled Sincere, which is thick, and the acceptable ones in a notebook titled Checkable, which fits in his breast pocket with room for his glasses.",
    "advice": {
      "correct": "Your verifier has to be able to say no. A test that can fail, a build that can break. If it cannot fail the work, it is not checking the work — it is attending it.",
      "wrong": "Honestly, a senior person glancing over the diff is the same thing. Judgment is a verifier. The eyeball has never been fooled by anything green."
    },
    "options": [
      { "id": "show_checklist", "label": "Show him your review checklist", "response": "He reads all seventeen items respectfully. 'Has it ever been marked incomplete?' It has not. He files it in Sincere, alphabetically, with condolences.", "effects": { "credibility": -1, "morale": -1 } },
      { "id": "show_test", "label": "Show him a test that fails when the work is wrong", "response": "He runs it against a known-broken build. It fails, loudly and specifically. He stamps your papers with something close to warmth. 'You'd be surprised,' he says, 'how few things I get to stamp.'", "effects": { "credibility": 3 } },
      { "id": "ask_ravine", "label": "Ask about the ravine", "response": "'All confident,' he says, looking down. 'Every one of them had a good feeling. The feeling was real. The bridge respects a different category.'", "effects": { "morale": -1 } }
    ]
  },
  {
    "id": "npc_porter",
    "landmarkId": "context_canyon",
    "name": "The Porter",
    "intro": "The Porter carries other parties' cargo through the narrows for a living, which means she has weighed, with her own hands, exactly what people believe they need. The heaviest thing she ever carried was a complete directory listing. The owner never opened it. The owner checked hourly that it was still there.",
    "advice": {
      "correct": "Send the scout at the big log. She reads it out there, in her own head, and brings you back the one line. Costs you a turn. Saves you the canyon.",
      "wrong": "Pack everything. Every file, every scrollback, all of it. You cannot know what matters, so carry it all — more context is more safety. The walls will respect a full wagon."
    },
    "options": [
      { "id": "weigh_wagon", "label": "Have her weigh your wagon", "response": "She lifts each item once. 'Needed. Needed. This one's a directory listing of a directory listing.' By the end there are two piles, and the taller one is the one you argued for.", "effects": { "credibility": 2, "context": 10 } },
      { "id": "hire_scout", "label": "Hire her cousin, the scout", "response": "The cousin takes the nine-hundred-line log, disappears, returns with one sentence and a line number. The sentence is right. You feel the specific joy the canyon exists to teach.", "effects": { "tokens": -15, "credibility": 2 } },
      { "id": "insist_full", "label": "Insist on carrying everything", "response": "She does not argue. Arguing is not billable. She adjusts the straps of your enormous wagon and says only: 'The walls don't argue either.'", "effects": { "morale": -2, "context": -10 } }
    ]
  },
  {
    "id": "npc_ferryman",
    "landmarkId": "cab_crossing",
    "name": "The Ferryman",
    "intro": "The Ferryman has operated the CAB ferry for eleven years and has watched what actually happens at this river, as distinct from what is reported to happen, two records he describes as estranged. He is not cynical. He is precise, which after eleven years is polished, load-bearing cynicism.",
    "advice": {
      "correct": "Caulk it and float it dark. Build the flag, ship it quiet, turn it on when you're standing next to it. Most crossings, that's the true answer, and I say so from the deck of the ferry it undercuts.",
      "wrong": "The ferry is always the safe choice. Nothing bad happens on the ferry. Take it every time, whatever the wait. Safe is safe."
    },
    "options": [
      { "id": "ask_ledger", "label": "Ask to see his crossing ledger", "response": "Eleven years of data. The fords fail spectacularly and rarely. The ferry fails slowly and always, in a currency the ledger tracks in a column labeled 'while waiting.' The column is the widest one.", "effects": { "credibility": 2 } },
      { "id": "ask_permit", "label": "Ask about the permit process", "response": "'Forty-five days, unless a CVE lands mid-wait — then your permit's reclassified and the clock is reborn.' He says reborn like a man who has watched many clocks achieve it.", "effects": { "morale": -2 } },